{
  "schema_version": "0.2.0",
  "interface_status": "proposed_pending_governor_review",
  "context_id": "urn:example:context:routine",
  "institution": {
    "institution_id": "urn:example:institution:service",
    "authority_domain": "customer-service",
    "authority_basis_ref": "urn:example:local-mandate:service",
    "authority_mode": "principle_inspired"
  },
  "principal": "urn:example:principal:service",
  "acting_identity": "urn:example:identity:service-bot",
  "accountable_human_role": {
    "role_id": "urn:example:role:service-owner",
    "human_principal": "urn:example:human:owner",
    "mandate_ref": "urn:example:mandate:owner"
  },
  "requirement": {
    "requirement_id": "urn:example:requirement:refund",
    "governing_sources": [
      {
        "ref": "urn:alvorada:design:constitution",
        "version": "v0.1",
        "provision": "I.1(22\u201325); IV.1",
        "standing": "design_proposal"
      },
      {
        "ref": "urn:example:policy:refund",
        "version": "1",
        "provision": "bounded refund class",
        "standing": "local_policy"
      }
    ],
    "permissions": [
      {
        "action": "refund",
        "targets": [
          "urn:example:account:customer-a"
        ],
        "data_scopes": [
          "refund-record"
        ],
        "max_amount": 25,
        "unit": "USD",
        "max_effects": 1
      }
    ],
    "approvals": [],
    "evidence": [
      {
        "obligation_id": "urn:example:obligation:eligibility",
        "kind": "authorization",
        "source_ref": "urn:example:records:eligibility",
        "max_age_seconds": 60,
        "required": true,
        "unknown_behavior": "hold_effect"
      },
      {
        "obligation_id": "urn:example:obligation:delivery",
        "kind": "post_effect",
        "source_ref": "urn:example:records:payments",
        "max_age_seconds": 60,
        "required": true,
        "unknown_behavior": "reconcile_no_blind_retry"
      }
    ],
    "consequence": {
      "tier": "T1",
      "rationale": "Invented bounded reversible refund; no adverse rights decision.",
      "profile_ref": "urn:alvorada:design:proportional-governance",
      "delay_limit": {
        "max_pending_seconds": 86400,
        "on_miss": "escalate_to_alternate_reviewer"
      }
    }
  },
  "conflicts": {
    "precedence_refs": [
      "urn:example:rules:controlling-law",
      "urn:example:policy:refund"
    ],
    "incompatible_role_pairs": [
      [
        "urn:example:role:executor",
        "urn:example:role:contested-reviewer"
      ]
    ],
    "escalation_ref": "urn:example:procedure:escalate",
    "appeal_ref": "urn:example:procedure:appeal",
    "continuity_ref": "urn:example:procedure:continuity",
    "remedy_ref": "urn:example:procedure:remedy"
  },
  "supporting_evidence_refs": [
    "urn:example:bitrep:attestation",
    "urn:example:index:claim"
  ],
  "change": {
    "kind": "none",
    "proposal_ref": null,
    "adoption_record_ref": null
  }
}
